fic_id,chapter_id,para_id,text,text_tokenized
606106,1,36,"""...I don't... I don't want them to be alone... I don't want them to be upset, I just...how do I fix it?""",""" ... I do n't ... I do n't want them to be alone ... I do n't want them to be upset , I just ... how do I fix it ? """
606106,1,37,The spirit Bruce laughed.,The spirit Bruce laughed .
606106,1,38,"""You're good at fixing things Tony... but to fix this, you need to fix yourself a little bit, first. When you've fixed yourself enough to let other people help you... then you'll open up a whole new world of opportunities. A whole new future. I know you can do it. Do you want to see what it could be like if you do?""",""" You 're good at fixing things Tony ... but to fix this , you need to fix yourself a little bit , first . When you 've fixed yourself enough to let other people help you ... then you 'll open up a whole new world of opportunities . A whole new future . I know you can do it . Do you want to see what it could be like if you do ? """
606106,1,39,"He didn't even hesitate before nodding, his innate inventor's curiousity getting the better of him.","He did n't even hesitate before nodding , his innate inventor 's curiousity getting the better of him ."
606106,1,40,"Bruce chuckled at that, too, and gestured back to the elevator.","Bruce chuckled at that , too , and gestured back to the elevator ."
606106,1,41,"""I can't show you that, Tony... only you can see it, because it's a future that's inextricably wound around you... you need to be led by a part of yourself to see that...""",""" I ca n't show you that , Tony ... only you can see it , because it 's a future that 's inextricably wound around you ... you need to be led by a part of yourself to see that ... """
606106,1,42,"""I don't... what the fuck does that even mean?!""",""" I do n't ... what the fuck does that even mean ? ! """
606106,1,43,"Bruce pointed, and a glowing blue ball waited by the elevator.","Bruce pointed , and a glowing blue ball waited by the elevator ."
606106,1,44,"""Jarvis will show you what will happen if you fix this... what you can create...""",""" Jarvis will show you what will happen if you fix this ... what you can create ... """
606106,1,45,"Tony had been about to argue, but then, for the second time that night, he closed his mouth. Of course it made sense - or as much sense as any of this was making - that it was Jarvis. Jarvis and the bots... definitely had a bit of him in them, a bit of his soul, his spirit... in Jarvis' case, and occasionally Dummy's possibly too much. But he loved them. He refused to change them. And so, without glancing back to see where his mind told him Bruce had been standing, he followed the blue light.","Tony had been about to argue , but then , for the second time that night , he closed his mouth . Of course it made sense - or as much sense as any of this was making - that it was Jarvis . Jarvis and the bots ... definitely had a bit of him in them , a bit of his soul , his spirit ... in Jarvis ' case , and occasionally Dummy 's possibly too much . But he loved them . He refused to change them . And so , without glancing back to see where his mind told him Bruce had been standing , he followed the blue light ."
606106,1,46,"They went to the roof, and it was cold there, Tony could certainly feel that, but the skies were clear, and this high up, he could even see a few stars as his breath misted in the air. There was a fire burning in a special fireplace in the middle of the roof terrace, and seven figures surrounded it, all seemingly roasting marshmallows, wrapped up warm in coats, and scarves and gloves. There was laughter, the occasional goodnatured curse, and an undercurrent of music that seemed to ebb and flow around the circle.","They went to the roof , and it was cold there , Tony could certainly feel that , but the skies were clear , and this high up , he could even see a few stars as his breath misted in the air . There was a fire burning in a special fireplace in the middle of the roof terrace , and seven figures surrounded it , all seemingly roasting marshmallows , wrapped up warm in coats , and scarves and gloves . There was laughter , the occasional goodnatured curse , and an undercurrent of music that seemed to ebb and flow around the circle ."
606106,1,47,"He could pick out all their voices, he found... Thor's was amazingly melodic, but the volume made it obvious. Natasha's, too, was pretty clear, sweet and high, like a songbird. Bruce was surprisingly warm, and blended well with Clint's which was pleasantly rough. Steve, of course, had the voice of the chorister he had once been, till his health had become too poor, and Coulson... Coulson didn't sing. But he hummed along with the archer who was emphatically settled in his arms.","He could pick out all their voices , he found ... Thor 's was amazingly melodic , but the volume made it obvious . Natasha 's , too , was pretty clear , sweet and high , like a songbird . Bruce was surprisingly warm , and blended well with Clint 's which was pleasantly rough . Steve , of course , had the voice of the chorister he had once been , till his health had become too poor , and Coulson ... Coulson did n't sing . But he hummed along with the archer who was emphatically settled in his arms ."
606106,1,48,"""Thanks for this Tony... it's nice to spend Christmas..."" Bruce shrugged, and Tony knew him well enough to read the rest of the sentence in it 'not alone', 'at home', there were so many things written in that simple movement... and he could read them all, understand them all, feel them all... because he felt the same, and his stomach twisted a little at the thought of what it would be like to have a family like this, to spend the holidays with them, to be with people who wanted to be with him... he couldn't quite wrap his head around it, but his reactor ached in his chest, and he knew he wanted to try.",""" Thanks for this Tony ... it 's nice to spend Christmas ... "" Bruce shrugged , and Tony knew him well enough to read the rest of the sentence in it ' not alone ' , ' at home ' , there were so many things written in that simple movement ... and he could read them all , understand them all , feel them all ... because he felt the same , and his stomach twisted a little at the thought of what it would be like to have a family like this , to spend the holidays with them , to be with people who wanted to be with him ... he could n't quite wrap his head around it , but his reactor ached in his chest , and he knew he wanted to try ."
606106,1,49,"""And the tree is great!"" That was Clint ""I can't wait for tomorrow, me and Bruce have split the cooking, it's going to be amazing...""",""" And the tree is great ! "" That was Clint "" I ca n't wait for tomorrow , me and Bruce have split the cooking , it 's going to be amazing ... """
606106,1,50,Even Natasha didn't look as uncomfortable as he would have anticipated Christmas making her.,Even Natasha did n't look as uncomfortable as he would have anticipated Christmas making her .
606106,1,51,"""Truly, Friend Tony... or perhaps, if I may call you brother,"" well, that was Thor, ""It is a great honour that you do me by permitting me to spend this mortal festival with those I consider to be like family to me. I understand the importance of celebrating that at this time, and I feel there is nowhere more proper for me to be than by your sides.""",""" Truly , Friend Tony ... or perhaps , if I may call you brother , "" well , that was Thor , "" It is a great honour that you do me by permitting me to spend this mortal festival with those I consider to be like family to me . I understand the importance of celebrating that at this time , and I feel there is nowhere more proper for me to be than by your sides . """
606106,1,52,"""Hear, hear."" That was Bruce, and he heard the clinking of glasses, or, in Thor's case, a bottle.",""" Hear , hear . "" That was Bruce , and he heard the clinking of glasses , or , in Thor 's case , a bottle ."
606106,1,53,"He stood, frozen in place for a long moment, and watched them continue, all those familiar faces lit by the orange glow... and there was real joy in them, not just the sadness that he usually associated with this time of year. It was strange to think that there might be hope, but then, if all the bullshit was to be believed, if there was hope at any time of year, it was at Christmas.","He stood , frozen in place for a long moment , and watched them continue , all those familiar faces lit by the orange glow ... and there was real joy in them , not just the sadness that he usually associated with this time of year . It was strange to think that there might be hope , but then , if all the bullshit was to be believed , if there was hope at any time of year , it was at Christmas ."
606106,1,54,"Eventually the vision faded, and he was left standing on the roof terrace, barefoot, in jeans and a t-shirt, feeling like an ice block. He shook himself and headed straight back inside. It wasn't too late, right? It couldn't be too late, not at Christmas.","Eventually the vision faded , and he was left standing on the roof terrace , barefoot , in jeans and a t - shirt , feeling like an ice block . He shook himself and headed straight back inside . It was n't too late , right ? It could n't be too late , not at Christmas ."
606106,1,55,"He considered getting Jarvis to put the calls out, but that wasn't personal enough, so he had grabbed his cellphone, and called everyone he could reach. There was no real way of getting through to Asgard, so he had to hope Thor would somehow magically get the hint... unless Doctor Foster knew something... he checked in with her too, and cracked his knuckles, pulling on a scarf, a coat, some boots, and heading out to get everything they would need. Sure, there wouldn't be much left at this stage, but what the hell, he was Tony Stark, it wasn't like money was an object, and for once, there was something more important.","He considered getting Jarvis to put the calls out , but that was n't personal enough , so he had grabbed his cellphone , and called everyone he could reach . There was no real way of getting through to Asgard , so he had to hope Thor would somehow magically get the hint ... unless Doctor Foster knew something ... he checked in with her too , and cracked his knuckles , pulling on a scarf , a coat , some boots , and heading out to get everything they would need . Sure , there would n't be much left at this stage , but what the hell , he was Tony Stark , it was n't like money was an object , and for once , there was something more important ."
606106,1,56,"They had all answered their phones - there hadn't really been that much of a chance that they wouldn't, even at midnight on Christmas Eve. Coulson had informed him that Natasha was back early from her mission, and that the SHIELD trio would arrive by half past the hour - that gave him almost no time, or didn't until he asked them to pick up some things on the way. Steve had jumped at the chance, and was practically on his scooter by the time Tony had given him his shopping list. Bruce was with him, and had rolled his eyes but obliged, and Jane Foster had somehow managed to communicate to Thor that he was needed back on Earth.","They had all answered their phones - there had n't really been that much of a chance that they would n't , even at midnight on Christmas Eve . Coulson had informed him that Natasha was back early from her mission , and that the SHIELD trio would arrive by half past the hour - that gave him almost no time , or did n't until he asked them to pick up some things on the way . Steve had jumped at the chance , and was practically on his scooter by the time Tony had given him his shopping list . Bruce was with him , and had rolled his eyes but obliged , and Jane Foster had somehow managed to communicate to Thor that he was needed back on Earth ."
606106,1,57,"Back at the tower, cold, overtired, overexcited, shaking a little with sheer exhaustion, every inch of Tony's body seemed to be humming as he grinned at them all, assembled again.","Back at the tower , cold , overtired , overexcited , shaking a little with sheer exhaustion , every inch of Tony 's body seemed to be humming as he grinned at them all , assembled again ."
606106,1,58,"It was Natasha who broke the silence, with her traditional sardonically quirked eyebrow.","It was Natasha who broke the silence , with her traditional sardonically quirked eyebrow ."
606106,1,59,"""What the hell got into you, Stark?""",""" What the hell got into you , Stark ? """
606106,1,60,"""I figured just because family might teach you that Christmas is shit... maybe the family you choose is more important than blood. I had a little sense knocked into me. We're a team, and we don't.... none of us have to be alone anymore.""",""" I figured just because family might teach you that Christmas is shit ... maybe the family you choose is more important than blood . I had a little sense knocked into me . We 're a team , and we do n't .... none of us have to be alone anymore . """
606106,1,61,"He saw the way Steve smiled at him then, the approval on Bruce's face, and he felt the colour rising in his own cheeks.","He saw the way Steve smiled at him then , the approval on Bruce 's face , and he felt the colour rising in his own cheeks ."
606106,1,62,"""Not even me.""",""" Not even me . """
