fic_id,chapter_id,para_id,text,text_tokenized
606106,1,1,"Anthony Edward Stark was a certified genius, a well known billionaire, and an infamous playboy. He had inherited his fortune, that much was true, but he certainly hadn't rested on his laurels - he had more than done his part to increase it. He had revolutionised weapons technology in the twenty first century, developing newer, smarter missiles, warheads, guidance systems, defence, in some cases, though he had always lived by his father's maxim: ""Peace means having a bigger stick than the other guy.""","Anthony Edward Stark was a certified genius , a well known billionaire , and an infamous playboy . He had inherited his fortune , that much was true , but he certainly had n't rested on his laurels - he had more than done his part to increase it . He had revolutionised weapons technology in the twenty first century , developing newer , smarter missiles , warheads , guidance systems , defence , in some cases , though he had always lived by his father 's maxim : "" Peace means having a bigger stick than the other guy . """
606106,1,2,"He spent his life on the traditional pleasures: wine, women, and song. Or at least, he did in the public eye. Many wondered how he had gone so long without a single relationship in his life - he could laugh it off easily enough, that was true, but the real truth of it was that there was a fourth love in his life, a demanding mistress, and a relationship which was toxic, occasionally to the extreme. First, and foremost, before anything else, Tony Stark had his work. It was his work which kept him up for 72 hours straight, sometimes more, which left him dizzy with exhaustion, completely worn, but buzzing too much to rest, it was the perfectionist streak in him which drove him to hide there, striving to meet a set of standards imagined in his father's voice, to which he could never measure up. It was easier to hide in his work, to not let the world see what a weak and pathetic failure he truly was.","He spent his life on the traditional pleasures : wine , women , and song . Or at least , he did in the public eye . Many wondered how he had gone so long without a single relationship in his life - he could laugh it off easily enough , that was true , but the real truth of it was that there was a fourth love in his life , a demanding mistress , and a relationship which was toxic , occasionally to the extreme . First , and foremost , before anything else , Tony Stark had his work . It was his work which kept him up for 72 hours straight , sometimes more , which left him dizzy with exhaustion , completely worn , but buzzing too much to rest , it was the perfectionist streak in him which drove him to hide there , striving to meet a set of standards imagined in his father 's voice , to which he could never measure up . It was easier to hide in his work , to not let the world see what a weak and pathetic failure he truly was ."
606106,1,3,"It had become harder to simply hide in his work after the Avengers initiative had been set up. Team mates had this annoying habit of sticking their noses into business where they didn't belong. He had been under pressure to give the team a home, after all, the rest of them were, for the most part, stuck in SHIELD quarters, and were jealous of the fact that he had taken Doctor Banner in. He liked Bruce, and Bruce understood about work, about science and tech. And the guy didn't have anywhere else to be. He found it reassuring that Bruce kept hours that were almost as erratic and unhealthy as Tony's own. It somehow condoned his own slow self destruction.","It had become harder to simply hide in his work after the Avengers initiative had been set up . Team mates had this annoying habit of sticking their noses into business where they did n't belong . He had been under pressure to give the team a home , after all , the rest of them were , for the most part , stuck in SHIELD quarters , and were jealous of the fact that he had taken Doctor Banner in . He liked Bruce , and Bruce understood about work , about science and tech . And the guy did n't have anywhere else to be . He found it reassuring that Bruce kept hours that were almost as erratic and unhealthy as Tony 's own . It somehow condoned his own slow self destruction ."
606106,1,4,"He never took Christmas off, but nobody knew that - why would they? It was easy to duck out of social engagements, because as far as everyone was concerned it was almost certain that he would have another engagement, a prior one, or a more impressive one, which outranked theirs, and so he played those off against each other. He gave the staff of Stark Tower - few though there were - the day off, at the very least, the week, for all non-essential staff, and so there was no one, had never been anyone, to bear witness to Tony Stark spending Christmas alone in his workshop with a bottle or three of scotch, and the bots. He never achieved anything productive, but losing himself in work sure beat all the forced cheer he could never quite stomach.","He never took Christmas off , but nobody knew that - why would they ? It was easy to duck out of social engagements , because as far as everyone was concerned it was almost certain that he would have another engagement , a prior one , or a more impressive one , which outranked theirs , and so he played those off against each other . He gave the staff of Stark Tower - few though there were - the day off , at the very least , the week , for all non - essential staff , and so there was no one , had never been anyone , to bear witness to Tony Stark spending Christmas alone in his workshop with a bottle or three of scotch , and the bots . He never achieved anything productive , but losing himself in work sure beat all the forced cheer he could never quite stomach ."
606106,1,5,"It was Christmas Eve, late, midnight possibly? He didn't know, he wasn't keeping track, engineering blindly on a tide of caffeine and alcohol. He hardly drank these days, but it helped keep the memories at bay. Memories of Christmas... he had enough for a lifetime. He didn't buy all the bullshit about the true spirit of the holiday. How could he? He knew for a fact it didn't exist. He hadn't slept in twenty four hours, and so wasn't surprised when the workshop began to waver. Had he eaten? He wasn't quite sure of that either...","It was Christmas Eve , late , midnight possibly ? He did n't know , he was n't keeping track , engineering blindly on a tide of caffeine and alcohol . He hardly drank these days , but it helped keep the memories at bay . Memories of Christmas ... he had enough for a lifetime . He did n't buy all the bullshit about the true spirit of the holiday . How could he ? He knew for a fact it did n't exist . He had n't slept in twenty four hours , and so was n't surprised when the workshop began to waver . Had he eaten ? He was n't quite sure of that either ..."
606106,1,6,"He was quite surprised, though, when Captain Steve Rogers appeared before him, and seemingly guided him to sit on the couch he kept in the workshop for those occasions when he passed out, handing him a plate with a peanut butter and jelly sandwich on it, the same way he usually did when he was of the opinion Tony needed to eat something, whether that be before a mission, after a mission... after a bender, first thing in the morning, last thing at night... the man seemed to have a complex about food, but then, Tony supposed, if you were used to there not being much of it around, the novelty of having plenty never quite wore off.","He was quite surprised , though , when Captain Steve Rogers appeared before him , and seemingly guided him to sit on the couch he kept in the workshop for those occasions when he passed out , handing him a plate with a peanut butter and jelly sandwich on it , the same way he usually did when he was of the opinion Tony needed to eat something , whether that be before a mission , after a mission ... after a bender , first thing in the morning , last thing at night ... the man seemed to have a complex about food , but then , Tony supposed , if you were used to there not being much of it around , the novelty of having plenty never quite wore off ."
606106,1,7,"Tony tried to ask him what he was doing there, but the man just smiled, and so, irritated, Tony took a swipe, only half in play, and blinked as his hand went right through Steve's chest, or where his eyes were telling him Steve's chest should be. Well, this was a first, he'd never hallucinated Steve Rogers before, but that being said, it was a hallucination he would have been quite happy to have again.","Tony tried to ask him what he was doing there , but the man just smiled , and so , irritated , Tony took a swipe , only half in play , and blinked as his hand went right through Steve 's chest , or where his eyes were telling him Steve 's chest should be . Well , this was a first , he 'd never hallucinated Steve Rogers before , but that being said , it was a hallucination he would have been quite happy to have again ."
606106,1,8,"""Well, I guess it's kinda neat that you picked my face for the past, even if it isn't really a surprise... I'm kinda wondering why you didn't pick your dad, except... well, I guess we're about to find out about that... "" he smiled sadly ""I get that this time of year isn't easy for you... mind if we take a look at the old days? Seeing as I didn't get to live through them myself...""",""" Well , I guess it 's kinda neat that you picked my face for the past , even if it is n't really a surprise ... I 'm kinda wondering why you did n't pick your dad , except ... well , I guess we 're about to find out about that ... "" he smiled sadly "" I get that this time of year is n't easy for you ... mind if we take a look at the old days ? Seeing as I did n't get to live through them myself ... """
606106,1,9,"Tony was more than a little wary of the idea of looking through the old memories. As far as he was concerned, he kept them back for a reason. He didn't need the years of coldness freezing his non-existent heart all over again.","Tony was more than a little wary of the idea of looking through the old memories . As far as he was concerned , he kept them back for a reason . He did n't need the years of coldness freezing his non - existent heart all over again ."
606106,1,10,"The Steve-vision took his hand, and Tony couldn't quite suppress the part of his brain that noted 'oh so that's interesting, if he initiates the contact, then there's a pressure, a sensation, but if /you/ initiate the contact... you're waving your hand through thin air, looking like an idiot.'","The Steve - vision took his hand , and Tony could n't quite suppress the part of his brain that noted ' oh so that 's interesting , if he initiates the contact , then there 's a pressure , a sensation , but if /you/ initiate the contact ... you 're waving your hand through thin air , looking like an idiot . '"
606106,1,11,"He followed the strange ghost from the workshop - after all, if it really was just a hallucination, then it wasn't like anyone else was there to see him making an idiot of himself.","He followed the strange ghost from the workshop - after all , if it really was just a hallucination , then it was n't like anyone else was there to see him making an idiot of himself ."
606106,1,12,"They went up, first, and overlayed in the living space which he was used to seeing filled either with builders, or with his team mates after a mission was a towering tree, at least ten feet tall, and perfectly decorated. The family that sat around it could have been from a Christmas card, except for their expressions. The young boy was sitting on the floor, back to his father, dark eyes shuttered, alone. Howard had a glass of whisky in his hand, just like always, and Maria cowered from whatever rant was currently making his old man's lips curl with hate, the occasional drop of spittle landing on her face which she made no move to wipe off.","They went up , first , and overlayed in the living space which he was used to seeing filled either with builders , or with his team mates after a mission was a towering tree , at least ten feet tall , and perfectly decorated . The family that sat around it could have been from a Christmas card , except for their expressions . The young boy was sitting on the floor , back to his father , dark eyes shuttered , alone . Howard had a glass of whisky in his hand , just like always , and Maria cowered from whatever rant was currently making his old man 's lips curl with hate , the occasional drop of spittle landing on her face which she made no move to wipe off ."
606106,1,13,"The Steve-ghost's eyes crinkled a little, and Tony could see genuine grief there, confusion that a friend he had looked up to so much could have become so bitter, so rotten inside... the truth was that it was easy for Stark men to fall from grace. Watching his father, watching himself when he had been younger... he had no trust for himself left. He knew that it wouldn't take much to turn him into a monster that was no different from Howard, and so he refused to give people the chance, pushed them away. It was easier that way.","The Steve - ghost 's eyes crinkled a little , and Tony could see genuine grief there , confusion that a friend he had looked up to so much could have become so bitter , so rotten inside ... the truth was that it was easy for Stark men to fall from grace . Watching his father , watching himself when he had been younger ... he had no trust for himself left . He knew that it would n't take much to turn him into a monster that was no different from Howard , and so he refused to give people the chance , pushed them away . It was easier that way ."
606106,1,14,"That wasn't the only memory, of course... they walked through other rooms, other Christmases he only wanted to forget, ones he had spent alone with a pile of presents bought without consideration of what he might truly want or need, ones he had been coerced into spending with Obie... memory after memory that left him shaking and sick, trying and failing to keep tears back from his cheeks.","That was n't the only memory , of course ... they walked through other rooms , other Christmases he only wanted to forget , ones he had spent alone with a pile of presents bought without consideration of what he might truly want or need , ones he had been coerced into spending with Obie ... memory after memory that left him shaking and sick , trying and failing to keep tears back from his cheeks ."
606106,1,15,"At the end of it all, the thing, this thing that looked like Steve but wasn't, couldn't possibly be, turned to him, rested a hand on his shoulder for a moment, used that hand to tilt Tony's head up to meet those impossibly blue eyes.","At the end of it all , the thing , this thing that looked like Steve but was n't , could n't possibly be , turned to him , rested a hand on his shoulder for a moment , used that hand to tilt Tony 's head up to meet those impossibly blue eyes ."
606106,1,16,"""I'm sorry for what happened to you, Tony,"" he said, ""But you need to know that you are not your father. You never have been. You are a thousand times the man your father was. Don't let him hold you back. You're better than that.""",""" I 'm sorry for what happened to you , Tony , "" he said , "" But you need to know that you are not your father . You never have been . You are a thousand times the man your father was . Do n't let him hold you back . You 're better than that . """
606106,1,17,"With that, the spirit dissipated into thin air as simply as it had appeared, leaving Tony to crumple to his knees on the hard, cold floor, face in his hands, tears he had refused to shed burning trails down his cheeks.","With that , the spirit dissipated into thin air as simply as it had appeared , leaving Tony to crumple to his knees on the hard , cold floor , face in his hands , tears he had refused to shed burning trails down his cheeks ."
606106,1,18,"The next pressure on his shoulder was different, warm, solid, but not sheer strength in the same way Steve's was. He knew, before he looked up, that it would be Bruce. He didn't know where these visions were coming from, what the point of them could possibly be... but he had to admit his mind could construct them perfectly, down to the last detail.","The next pressure on his shoulder was different , warm , solid , but not sheer strength in the same way Steve 's was . He knew , before he looked up , that it would be Bruce . He did n't know where these visions were coming from , what the point of them could possibly be ... but he had to admit his mind could construct them perfectly , down to the last detail ."
606106,1,19,"Those kind brown eyes, so much older than his although there was only a few years difference smile down at him, and the thumb rough from lab work, from travel, from a hard life, well lived, skimmed his cheekbone, cool against the heat of the tears there. He guided Tony up, and squeezed him briefly.","Those kind brown eyes , so much older than his although there was only a few years difference smile down at him , and the thumb rough from lab work , from travel , from a hard life , well lived , skimmed his cheekbone , cool against the heat of the tears there . He guided Tony up , and squeezed him briefly ."
606106,1,20,"""You don't have to cut yourself off like this, you know... """,""" You do n't have to cut yourself off like this , you know ... """
606106,1,21,"Tony didn't know what to say to that, tried to open his mouth to defend himself, but felt a lump in his throat, which wouldn't go away, no matter how he tried to clear it.","Tony did n't know what to say to that , tried to open his mouth to defend himself , but felt a lump in his throat , which would n't go away , no matter how he tried to clear it ."
606106,1,22,"""Let's have a look at the alternatives...""",""" Let 's have a look at the alternatives ... """
606106,1,23,"They began to walk again, through the tower, through parts of it even Tony didn't recognise, the parts he had considered making into space for the team, before he had remembered that they wouldn't want to live with him anyway, and that he was so much better off without them intruding, and always being underfoot, and wanting to change him, lecturing him, forcing him to eat and drink, and live like a normal person.","They began to walk again , through the tower , through parts of it even Tony did n't recognise , the parts he had considered making into space for the team , before he had remembered that they would n't want to live with him anyway , and that he was so much better off without them intruding , and always being underfoot , and wanting to change him , lecturing him , forcing him to eat and drink , and live like a normal person ."
606106,1,24,"It was the top floor, first, the one he would have given to Clint, obviously. It looked like SHIELD quarters, from what he could remember of them, and Clint was sitting on the bed, bow in his hands, turning it over and over, his quiver beside him on the bed. Someone had stuck a bow onto it, and there were two single solitary cards.","It was the top floor , first , the one he would have given to Clint , obviously . It looked like SHIELD quarters , from what he could remember of them , and Clint was sitting on the bed , bow in his hands , turning it over and over , his quiver beside him on the bed . Someone had stuck a bow onto it , and there were two single solitary cards ."
606106,1,25,"""He went to the SHIELD Christmas party. Didn't stay long, he doesn't feel at home in places like that, he feels out of place, and unwanted, he knows the others aren't comfortable with him anyway. I mean, they weren't before New York, but since..."" Bruce shrugged ""He doesn't really have a place, except with the other Avengers. Coulson will come in, in a bit, and spend some time with him, but neither of them really get into the holiday spirit these days. Clint's never had a proper Christmas.""",""" He went to the SHIELD Christmas party . Did n't stay long , he does n't feel at home in places like that , he feels out of place , and unwanted , he knows the others are n't comfortable with him anyway . I mean , they were n't before New York , but since ... "" Bruce shrugged "" He does n't really have a place , except with the other Avengers . Coulson will come in , in a bit , and spend some time with him , but neither of them really get into the holiday spirit these days . Clint 's never had a proper Christmas . """
606106,1,26,"""Yeh well... he's not the only one, is he."" Tony couldn't quite keep back the bitter reply, but then, he wouldn't have been himself if he had, and so he didn't regret it.",""" Yeh well ... he 's not the only one , is he . "" Tony could n't quite keep back the bitter reply , but then , he would n't have been himself if he had , and so he did n't regret it ."
606106,1,27,"Bruce's reply was mild, though, as it always was ""No, he isn't... Natasha is on a mission, even on Christmas. She prefers it to having to think about things but everyone has their coping mechanisms...""","Bruce 's reply was mild , though , as it always was "" No , he is n't ... Natasha is on a mission , even on Christmas . She prefers it to having to think about things but everyone has their coping mechanisms ... """
606106,1,28,"""And what about you? Where are you?""",""" And what about you ? Where are you ? """
606106,1,29,"""Steve invited me down to a charity thing at a local orphanage and foster home. They're all wild to see Captain America. Not so happy about me, but they welcomed me all the same. After that, we go home. In Steve's case, to an empty room, where he can remember every single person he has lost, because he has nothing that he might have gained. No friend, no team mate, because he has lost everything he ever knew. The world he once had. In my case to an unlit tower, empty apart from the one person in this world I might count as a friend, and who will never let me in.""",""" Steve invited me down to a charity thing at a local orphanage and foster home . They 're all wild to see Captain America . Not so happy about me , but they welcomed me all the same . After that , we go home . In Steve 's case , to an empty room , where he can remember every single person he has lost , because he has nothing that he might have gained . No friend , no team mate , because he has lost everything he ever knew . The world he once had . In my case to an unlit tower , empty apart from the one person in this world I might count as a friend , and who will never let me in . """
606106,1,30,"""I-..."" Tony went to protest, but realised he had no basis for it. He didn't let Bruce in. He didn't let anyone in. It was how this worked. How he worked. It was safer that way, for him, and them. There were only so many times a heart could break before it became irreparable, after all, and it was a gamble he had long ago decided was not worth taking. If even his parents couldn't love him, what was the chance of anyone else wanting him.",""" I- ... "" Tony went to protest , but realised he had no basis for it . He did n't let Bruce in . He did n't let anyone in . It was how this worked . How he worked . It was safer that way , for him , and them . There were only so many times a heart could break before it became irreparable , after all , and it was a gamble he had long ago decided was not worth taking . If even his parents could n't love him , what was the chance of anyone else wanting him ."
606106,1,31,"""Thor is at home for Christmas, because the one thing he has taken from it is that it's a time that's meant to be spent with family... he's not close to his father anymore, though, after what happened with Loki, who is still in prison, and isn't willing to speak to him, and his mother is by his father's side all the time. He'd rather spend it here, with the family he's chosen.... except that it seems that family has made it clear that they don't want him either.""",""" Thor is at home for Christmas , because the one thing he has taken from it is that it 's a time that 's meant to be spent with family ... he 's not close to his father anymore , though , after what happened with Loki , who is still in prison , and is n't willing to speak to him , and his mother is by his father 's side all the time . He 'd rather spend it here , with the family he 's chosen .... except that it seems that family has made it clear that they do n't want him either . """
606106,1,32,"""Hey, what-...""",""" Hey , what- ... """
606106,1,33,"""They chose not to spend Christmas together, to Thor that means that for all that they are his family, he doesn't mean enough to them, and they don't mean enough to each other, to spend the time together.""",""" They chose not to spend Christmas together , to Thor that means that for all that they are his family , he does n't mean enough to them , and they do n't mean enough to each other , to spend the time together . """
606106,1,34,"""...Oh..."" well, that made sense at least, and goddamn if that didn't make Tony feel like a terrible person, ""I... uh...""",""" ... Oh ... "" well , that made sense at least , and goddamn if that did n't make Tony feel like a terrible person , "" I ... uh ... """
606106,1,35,"Bruce shrugged, and gave him that little smile which meant 'I am disappointed in you but I know you didn't mean it, so I still love you anyway'. Tony was more than familiar with that smile.","Bruce shrugged , and gave him that little smile which meant ' I am disappointed in you but I know you did n't mean it , so I still love you anyway ' . Tony was more than familiar with that smile ."
